{"step":4,"slug":"hermes-spec-to-pr-enhancements","workflowId":"hermes-spec-to-pr-enhancements-20260905T015600Z","workflowType":"standard","status":"completed","artifactPaths":[".agents/skills/ws-spec-to-pr/STEP-DISPATCH.md","bin/skill-integrity.json"],"acRefs":[],"summary":"E1 D1 clause added to STEP-DISPATCH Step 4 row (skill owns Fix-Entire-Defect-Class; orch confirms sweep before verify). E2 matrix: AC1-AC6 re-verified present, no rename regressions (ADO log-fetch parity confirmed; ship-pr:24 is provider-routing prose). Targeted hermes + parity tests exit 0; integrity generate+verify exit 0; check_workflows 0 critical.","nextAction":"Run step 5","findings":{"critical":0,"warning":0,"suggestion":0,"info":0}}
