{"step":4,"slug":"provider-fetch-visual-attachments","workflowId":"provider-fetch-visual-attachments-20260903T131113Z","workflowType":"standard","status":"completed","artifactPaths":[".agents/skills/ws-shared/scripts/ingest_visual_attachments.cjs","test/test-visual-attachment-ingest.js",".agents/skills/ws-shared/scm-provider-contract.md",".agents/skills/ws-spec-provider-github/scripts/github-issue-to-spec.py",".agents/skills/ws-spec-provider-github/SKILL.md",".agents/skills/ws-spec-provider-github/INTENTS.md",".agents/skills/ws-spec-provider-azure-devops/scripts/ado-workitem-to-spec.py",".agents/skills/ws-spec-provider-azure-devops/SKILL.md",".agents/skills/ws-spec-provider-azure-devops/INTENTS.md",".agents/skills/ws-spec-provider-local/scripts/register_local_spec.cjs",".agents/skills/ws-spec-provider-local/SKILL.md",".agents/skills/ws-spec-write/SKILL.md",".agents/skills/ws-spec-format/FORMAT.md",".agents/skills/ws-plan-write/SKILL.md",".agents/skills/ws-plan-interview/SKILL.md",".agents/skills/ws-implement-tasks/SKILL.md",".agents/skills/ws-spec-from-provider/SKILL.md",".agents/skills/ws-cleanup/references/PATTERNS.md","FEATURES.md","test/test-provider-parity.js","package.json"],"acRefs":[],"summary":"Finished step 4","nextAction":"Run step 5","findings":{"critical":0,"warning":0,"suggestion":0,"info":0}}
