{"step":3,"slug":"hermes-spec-to-pr-enhancements","workflowId":"hermes-spec-to-pr-enhancements-20260905T015600Z","workflowType":"standard","status":"skipped","artifactPaths":[],"acRefs":[],"summary":"Step 3 sequential stub: enableDag false; exec plan + dag json written via write_sequential_dag.cjs; plan of record is the refined plan.","nextAction":"Run step 4","findings":{"critical":0,"warning":0,"suggestion":0,"info":0}}
