{"step":3,"slug":"us-275","workflowId":"us-275-20260904T020000Z","workflowType":"standard","status":"skipped","artifactPaths":[".agents/plans/us-275/step-03-us-275.plan.exec.md",".agents/plans/us-275/step-03-us-275.exec.dag.json"],"acRefs":[],"summary":"DAG disabled; sequential exec stub written.","nextAction":"Run step 4","findings":{"critical":0,"warning":0,"suggestion":0,"info":0}}
