{"step":2,"slug":"skill-family-naming","workflowId":"skill-family-naming-20260902T215014Z","workflowType":"standard","status":"completed","artifactPaths":[".agents/plans/skill-family-naming/step-02-skill-family-naming.plan.refined.md"],"acRefs":[],"summary":"Interview completed and plan refined with memory trap mitigations","nextAction":"Run step 3","findings":{"critical":0,"warning":0,"suggestion":0,"info":0}}
