{"step":1,"slug":"us-275","workflowId":"us-275-20260904T020000Z","workflowType":"standard","status":"completed","artifactPaths":[".agents/plans/us-275/step-01-us-275.plan.md",".agents/plans/us-275/plan.index.json"],"acRefs":[],"summary":"Wrote step-01 plan; plan.index.json built; force_interview true from High MEMORY traps.","nextAction":"Run step 2","findings":{"critical":0,"warning":0,"suggestion":0,"info":0}}
