{"step":1,"slug":"skill-family-naming","workflowId":"skill-family-naming-20260902T215014Z","workflowType":"standard","status":"completed","artifactPaths":[".agents/plans/skill-family-naming/step-01-skill-family-naming.plan.md",".agents/plans/skill-family-naming/plan.index.json"],"acRefs":[],"summary":"Plan generated and indexed for skill family naming refactor","nextAction":"Run step 2","findings":{"critical":0,"warning":0,"suggestion":0,"info":0}}
