{"step":6,"slug":"provider-fetch-visual-attachments","workflowId":"provider-fetch-visual-attachments-20260903T131113Z","workflowType":"standard","status":"completed","artifactPaths":[".agents/plans/provider-fetch-visual-attachments/step-06-provider-fetch-visual-attachments.review.md",".agents/plans/provider-fetch-visual-attachments/step-06-provider-fetch-visual-attachments.review.r1.md"],"acRefs":[],"summary":"Finished step 6","nextAction":"Run step 7","findings":{"critical":0,"warning":0,"suggestion":0,"info":0}}
