{"step":1,"slug":"hermes-spec-to-pr-enhancements","workflowId":"hermes-spec-to-pr-enhancements-20260905T015600Z","workflowType":"standard","status":"completed","artifactPaths":[],"acRefs":[],"summary":"Step 1 plan complete: E1 D1-only delta (STEP-DISPATCH Step 4 orch reminder) + E2 re-verification matrix + E3 gates. Memory consult exit 2, force_interview true, interview required.","nextAction":"Run step 2","findings":{"critical":0,"warning":0,"suggestion":0,"info":0}}
