{"step":2,"slug":"us-275","workflowId":"us-275-20260904T020000Z","workflowType":"standard","status":"completed","artifactPaths":[".agents/plans/us-275/step-02-us-275.plan.refined.md",".agents/plans/us-275/plan.index.json"],"acRefs":[],"summary":"Interview confirmed; refined plan written; shared_understanding confirmed.","nextAction":"Run step 3","findings":{"critical":0,"warning":0,"suggestion":0,"info":0}}
