{"step":7,"slug":"us-275","workflowId":"us-275-20260904T020000Z","workflowType":"standard","status":"completed","artifactPaths":[".agents/plans/us-275/step-07-us-275.testing.plan.md",".agents/plans/us-275/step-07-us-275.testing.report.md"],"acRefs":[],"summary":"npm test exit 0; mutation skipped; sabotage passed.","nextAction":"Run step 8","findings":{"critical":0,"warning":0,"suggestion":0,"info":0}}
