{"step":6,"slug":"hermes-spec-to-pr-enhancements","workflowId":"hermes-spec-to-pr-enhancements-20260905T015600Z","workflowType":"standard","status":"completed","artifactPaths":[".agents/skills/ws-spec-to-pr/STEP-DISPATCH.md","bin/skill-integrity.json"],"acRefs":[],"summary":"Step 6 review round 1 clean: No feedback, score 10/10, fable VERIFIED, lite exemption named. No Critical/Warning; fix loop not entered; no review-fix commit.","nextAction":"Run step 7","findings":{"critical":0,"warning":0,"suggestion":0,"info":0}}
