{"step":4,"slug":"us-250","workflowId":"us-250-20260827T143734Z","workflowType":"lite","status":"completed","artifactPaths":[".agents/plans/us-250/step-08-us-250.result.md"],"acRefs":[],"summary":"Finished step 4","nextAction":"Run step 5","findings":{"critical":0,"warning":0,"suggestion":0,"info":0}}
