{"step":0,"slug":"provider-fetch-visual-attachments","workflowId":"provider-fetch-visual-attachments-20260903T131113Z","workflowType":"standard","status":"completed","artifactPaths":[".agents/plans/provider-fetch-visual-attachments/step-00-provider-fetch-visual-attachments.spec.md",".agents/plans/provider-fetch-visual-attachments/step-00-provider-fetch-visual-attachments.classify.md",".agents/plans/provider-fetch-visual-attachments/step-00-prior-work.json",".agents/plans/provider-fetch-visual-attachments/ac-ledger.json"],"acRefs":[],"summary":"Finished step 0","nextAction":"Run step 1","findings":{"critical":0,"warning":0,"suggestion":0,"info":0}}
